"packageid","title","abstract","new_keywords"
"knb-lter-arc.20123","Soil temperatures and moisture for Arctic Long Term Experimental Research (ARC LTER) heath experimental plots, Toolik Field Station, North Slope Alaska for 2001-2018. ","Soil temperatures  at 2 depths, 5 and 10 cm, canopy temperatures and soil moisture at 10 cm  were  measured  in a heath tundra Arctic Long Term Experimental Research (ARC-LTER) site  at Toolik Lake Field Station, North slope, Alaska.  Air temperature and relative humidity  and global radiation were also measured but are presented in another dataset.   Only  control and nutrient addition (nitrogen plus phosphorus ) treatments plots were measured .","biogeochemistry, meteorology, soil science, community, air, landform, layer, nitrogen cycle, inorganic matter, nutrient, phosphorus cycle, temperature, radiation, relative humidity, soil moisture, soil temperature, canopy, air, hillslope, canopy, nitrogen, inorganic nutrient, phosphorus, air temperature"
"knb-lter-arc.20125","Repeated synoptic watershed chemistry from three watersheds near Toolik Field Station, Alaska, summer 2016-2018","Data file describing repeated sampling of chemistry of distributed river water from the Kuparuk River, Oksrukuyik Creek, and Trevor Creek watersheds near Toolik Field Station, North Slope of Alaska. Data file includes sampling date, season, sampling point,  subcatchment area, and resulting concentrations for a suite of solutes.","biogeochemistry, aquatic, landform, carbon, nitrogen cycle, inorganic matter, nutrient, freshwater, stream, hillslope, watershed, nitrogen, inorganic nutrient"
"knb-lter-arc.20128","Relative percent cover and leaf nutrients was measured for plant species on Arctic LTER experimental plots in moist acidic and non-acid tundra, Arctic LTER Toolik Field Station, Alaska 2015","Relative percent cover was measured for plant species on Arctic LTER experimental plots at Toolik field station in moist acidic and non-acidic tundrain greenhouse and control plots. Leaf percent carbon, percent nitrogen and percent phosphorus were collected from dominant species in greenhouse and control plotson Arctic LTER experimental plots at Toolik field station in moist acidic, non-acidic tundra, wet sedge and shrubtundra","biogeochemistry, ecology, experiment, plant part, manipulation process, carbon, nitrogen cycle, inorganic matter, nutrient, phosphorus cycle, biodiversity, greenhouse, leaf, warming, nitrogen, inorganic nutrient, phosphorus, community dynamics, plant cover"
"knb-lter-arc.20129","Soil biogeochemical variables collected on the Arctic LTER experimental plots in moist acidic, moist non-acidic, wet shrub and shrub tundra, Arctic LTER Toolik Field Station, Alaska 2015","We investigated the effect of long-term warming on multiple soil and microbial carbon, nitrogen, and phosphorus pools, and microbial extracellular enzyme activities, with a particular focus on phosphorus, in Alaskan tundra plots underlain by permafrost","biogeochemistry, plant, manipulation process, landform, carbon, nitrogen cycle, inorganic matter, nutrient, phosphorus cycle, vascular plant, warming, permafrost, nitrogen, inorganic nutrient, phosphorus, shrub"
"knb-lter-arc.20130","Modeling the effect of explicit vs implicit representation of grazing on ecosystem carbon and nitrogen cycling in response to elevated carbon dioxide and warming in arctic tussock tundra, Alaska - Dataset A","We use a simple model of coupled carbon and nitrogen cycles in terrestrial ecosystems to examine how explicitly representing grazers versus having grazer effects implicitly aggregated in with other biogeochemical processes in the model alters predicted responses to elevated carbon dioxide and warming.  The aggregated approach can affect model predictions because grazer-mediated processes can respond differently to changes in climate from the processes with which they are typically aggregated.  We use small-mammal grazers in arctic tundra as an example and find that the typical three-to-four-year cycling frequency is too fast for the effects of cycle peaks and troughs to be fully manifested in the ecosystem biogeochemistry.  We conclude that implicitly aggregating the effects of small-mammal grazers with other processes results in an underestimation of ecosystem response to climate change relative to estimations in which the grazer effects are explicitly represented.  The magnitude of this underestimation increases with grazer density.  We therefore recommend that grazing effects be incorporated explicitly when applying models of ecosystem response to global change.","biogeochemistry, ecology, ecosphere event, animal, biogeochemical process, community process, environmental process, manipulation process, measurement process, carbon, nitrogen cycle, biodiversity, disturbance, vertebrate, carbon, herbivory, disturbance, warming, modeling, nitrogen, density, mammal, grazing"
"knb-lter-arc.20131","Modeling the effect of explicit vs implicit representation of grazing on ecosystem carbon and nitrogen cycling in response to elevated carbon dioxide and warming in arctic tussock tundra, Alaska - Dataset B","We use a simple model of coupled carbon and nitrogen cycles in terrestrial ecosystems to examine how explicitly representing grazers versus having grazer effects implicitly aggregated in with other biogeochemical processes in the model alters predicted responses to elevated carbon dioxide and warming.  The aggregated approach can affect model predictions because grazer-mediated processes can respond differently to changes in climate from the processes with which they are typically aggregated.  We use small-mammal grazers in arctic tundra as an example and find that the typical three-to-four-year cycling frequency is too fast for the effects of cycle peaks and troughs to be fully manifested in the ecosystem biogeochemistry.  We conclude that implicitly aggregating the effects of small-mammal grazers with other processes results in an underestimation of ecosystem response to climate change relative to estimations in which the grazer effects are explicitly represented.  The magnitude of this underestimation increases with grazer density.  We therefore recommend that grazing effects be incorporated explicitly when applying models of ecosystem response to global change.","biogeochemistry, ecology, ecosphere event, animal, biogeochemical process, community process, environmental process, manipulation process, measurement process, carbon, nitrogen cycle, biodiversity, disturbance, vertebrate, carbon, herbivory, disturbance, warming, modeling, nitrogen, density, mammal, grazing"
"knb-lter-arc.20132","Steady state carbon, nitrogen, phosphorus, and water budgets for twelve mature ecosystems ranging from prairie to forest and from the arctic to the tropics","We use the Multiple Element Limitation (MEL) model to examine the responses of twelve ecosystems - from the arctic to the tropics and from grasslands to forests - to elevated carbon dioxide (CO2), warming, and 20% decreases or increases in annual precipitation. The ecosystems we simulated include moist acidic tundra, shrub tundra, and wet sedge tundra near Toolik Lake, Alaska, alpine dry meadow tundra near Niwot Ridge, Colorado, restored tallgrass prairie near Kellogg Biological Station, Michigan, native tallgrass prairie at the Konza Prairie, Kansas, upland and lowland boreal forest near Bonanza Creek, Alaska, temperate coniferous forest in HJ Andrews Experimental Forest, Oregon, a northern hardwood forest in Hubbard Brook Experimental Forest, New Hampshire, a transition oak-maple forest in Harvard Forest, Massachusetts, and lowland tropical rainforest near Caxiuan National Forest, Par, Brazil.For each of the twelve sites, we run six 100-year simulations beginning from the calibrated steady state (72 simulations total).  The six simulations are: (1) increasing CO2 from 400 to 800 mol mol-1, (2) warming from current temperatures to current plus 3.5oC, (3) decreasing precipitation from 100% to 80% of the current annual rate, (4) increasing precipitation from 100% to 120% of the current annual rate, (5) doubling of CO2, 3.5oC warming, and 20% decrease in precipitation, and (6) doubling of CO2, 3.5oC warming, and 20% increase in precipitation.The carbon, nitrogen, phosphorus, and water budgets presented here are used to calibrate the MEL model prior to running the climate change simulations. Citations and calculations for the data presented here are described in the individual site html files included in this dataset.","biogeochemistry, meteorology, terrestrial, ecosphere event, model, plant, biogeochemical process, biological process, environmental process, hydrologic process, manipulation process, measurement process, carbon, nitrogen cycle, nutrient, phosphorus cycle, precipitation, temperature, forest, grassland, disturbance, simulation, vascular plant, carbon, nutrient, production, disturbance, precipitation, warming, modeling, simulation, nitrogen, phosphorus, shrub, primary production"
"knb-lter-arc.20133","Ecosystem responses to changes in climate and carbon dioxide in twelve mature ecosystems ranging from prairie to forest and from the arctic to the tropics","We use the Multiple Element Limitation (MEL) model to examine the responses of twelve ecosystems - from the arctic to the tropics and from grasslands to forests - to elevated carbon dioxide (CO2), warming, and 20% decreases or increases in annual precipitation. The ecosystems we simulated include moist acidic tundra, shrub tundra, and wet sedge tundra near Toolik Lake, Alaska, alpine dry meadow tundra near Niwot Ridge, Colorado, restored tallgrass prairie near Kellogg Biological Station, Michigan, native tallgrass prairie at the Konza Prairie, Kansas, upland and lowland boreal forest near Bonanza Creek, Alaska, temperate coniferous forest in HJ Andrews Experimental Forest, Oregon, a northern hardwood forest in Hubbard Brook Experimental Forest, New Hampshire, a transition oak-maple forest in Harvard Forest, Massachusetts, and lowland tropical rainforest near Caxiuan National Forest, Par, Brazil.For each of the twelve sites, we run six 100-year simulations beginning from the calibrated steady state (72 simulations total).  The six simulations are: (1) increasing CO2 from 400 to 800 mol mol-1, (2) warming from current temperatures to current plus 3.5oC, (3) decreasing precipitation from 100% to 80% of the current annual rate, (4) increasing precipitation from 100% to 120% of the current annual rate, (5) doubling of CO2, 3.5oC warming, and 20% decrease in precipitation, and (6) doubling of CO2, 3.5oC warming, and 20% increase in precipitation.This dataset consists of the MEL model Windows executable, the driver and parameter file for each site, and the output files for each of the six simulations listed above.","biogeochemistry, meteorology, terrestrial, ecosphere event, model, plant, biogeochemical process, biological process, environmental process, hydrologic process, manipulation process, measurement process, carbon, nitrogen cycle, nutrient, phosphorus cycle, precipitation, temperature, forest, grassland, disturbance, simulation, vascular plant, carbon, nutrient, production, disturbance, precipitation, warming, modeling, simulation, nitrogen, phosphorus, shrub, primary production"
"knb-lter-arc.20134","Tussock height and diameter in moist acidic tussock tundra at the site of the 2007 Anaktuvuk River fire scar, and nearby unburned tundra measured in 2016","This dataset consists of Eriophorum vaginatum tussock height and width (diameter) measurements, and was used to evaluate differences in physical strucutre of previously burned tundra (2007 Anaktuvuk River fire) and nearby unburned tundra. At each site, all tussocks that intersected four 100 meter transects were measured from soil surface to tussock top in four cardinal directions, and diameter was measured in two directions. These data were used to examine the impact of post-fire changes in plant community composition and structure on habitat suitability and rodent herbivore activity in response to a large, severe, and unprecedented fire in northern Alaska moist acidic tundra.","ecology, ecosphere event, field method, community, environmental process, biodiversity, disturbance, fire, transect, herbivore, disturbance, community dynamics, species diversity"
"knb-lter-arc.20135","Tussock (Eriophorum vaginatum) density, mortality, and rodent-herbivore activity in moist acidic tussock tundra at the site of the 2007 Anaktuvuk River fire and nearby unburned tundra, measured in 2019","This dataset consists of tussock density, mortality rates and causes, and an assesment of rodent-herbivore activity levels in previously burned (2007 Anaktuvuk River fire) and unburned tussock tundra. Eriophourm vaginatum tussocks were counted every meter within a 1 square meter quadrat along three transects. Cause of tussock mortality, as well as level of rodent herbivory was assessed for each tussock, and rodent herbivore activity was assessed for each quadrat. The goal of the project was to examine the impact of post-fire changes in plant community composition and structure on habitat suitability and rodent herbivore activity in response to a large, severe, and unprecedented fire in northern Alaska moist acidic tundra.","ecology, ecosphere event, field method, community, animal, community process, environmental process, biodiversity, disturbance, fire, transect, herbivore, vertebrate, herbivory, mortality, disturbance, community dynamics, density, species diversity, mammal"
"knb-lter-arc.20136","Leaf area index (LAI) by plant functional group in moist acidic tussock tundra, at the 2007 Anaktuvuk River fire scar measured in 2017","This file contains leaf area index (LAI) based on biomass measurements from an aboveground pluck in the southern portion of the Anaktuvuk River fire scar, and a nearby unburned site in late July 2017. Vegetation was sampled randomly at 10-m intervals along two 100 meter transects at both the burned and unburned sites. Vegetation was sampled within a 10X40 cm quadrat to the mineral layer, and plant material was sorted into new and old aboveground leaf and woody biomass by species. All samples were dried and weighed, and subsampled leaf material was scanned to determine specific leaf area (centimeterSquaredPerGram biomass) per species, which was then used to transform leaf biomass (gramPerMeterSquared) into the leaf area index for each site.","ecology, ecosphere event, field method, community, community, plant part, biological process, environmental process, biodiversity, disturbance, fire, transect, vegetation, vegetation, leaf, wood, production, disturbance, vegetation dynammics, leaf area index, leaf area"
"knb-lter-arc.20137","Point-frame measurement of maximum canopy height for plant growth forms at the 2007 Anaktuvuk River Fire scar measured in 2019.","This file contains maximum plant heights from point frame measurements made in the southern section of the 2007 Anaktuvuk River fire scar, at a severely burned site and a nearby unburned site. Pin-vegetation contact was recorded using a 0.56 m2 frame with 41 evenly spaced sampling points. Data were collected during peak green in summer 2019. These data were used to examine the impact of post-fire changes in plant community composition and structure on habitat suitability and rodent herbivore activity in response to a large, severe, and unprecedented fire in northern Alaska moist acidic tussock tundra.","ecology, ecosphere event, community, community, biological process, environmental process, layer, biodiversity, disturbance, fire, herbivore, vegetation, canopy, vegetation, growth, disturbance, canopy, community dynamics, plant cover, species diversity, vegetation dynammics"
"knb-lter-arc.20138","Small mammal captures per 100 trap nights at the 2007 Anaktuvuk River fire scar and nearby unburned site, sampled in 2014, 2017-2019.","Small mammals (rodents and shrews) were sampled 7-12 years following the Anaktuvuk River Fire to examine how post-fire ecological changes influence small mammal abundance. Small mammals were snap-trapped in August  2014, 2017-2019 at the site of the 2007 Anaktuvuk River Fire, and a nearby unburned control site. At each site, 120 traps were set in 3 parallel lines spaced 40m apart. Each trap was spaced 10m apart, baited, and set to rodent sign within one meter of the trap station. Traps were checked the following two mornings with all captures collected and sprung traps reset. Abundance estimates (captures per 100 trap nights) are presented for tundra voles (Microtus oeconomus), red-backed voles (Myodes rutilus) and shrews (Sorex spp.) The goals of the project were to examine the impact of post-fire changes in plant community composition and structure on habitat suitability and rodent herbivore activity in response to a large, severe, and unprecedented fire in northern Alaska moist acidic tundra.","ecology, ecosphere event, community, animal, community process, environmental process, measurement process, biodiversity, disturbance, fire, herbivore, vertebrate, herbivory, disturbance, trapping, abundance, community dynamics, species diversity, mammal"
"knb-lter-arc.20139","Eriophorum vaginatum tiller nitrogen content at the 2007 Anaktuvuk River fire scar and nearby unburned tundra measured in 2019.","Tillers from 24 Eriophorum vaginatum individuals were sampled in late July 2019 to examine differences in percent nitrogen between previously burned (Anaktuvuk River Fire) and unburned tussocks at a nearby unburned control site. At the burned site tussocks exhibiting evidence of rodent grazing were also sampled to separate herbivore effects from those of the fire. From each tussock, 3-4 new leaves were sampled (as indicated by lack of brown tips) and dried at 60C for 24 hours, before being ground and analyzed for percent nitrogen. The goals of the project were to examine the impact of post-fire changes in plant community composition, nutrient quality and structure on habitat suitability and rodent herbivore activity in response to a large, severe, and unprecedented fire in northern Alaska moist acidic tundra.","biogeochemistry, ecology, ecosphere event, community, plant part, community process, environmental process, nitrogen cycle, nutrient, biodiversity, disturbance, fire, herbivore, leaf, herbivory, disturbance, nitrogen, community dynamics, species diversity, grazing"
"knb-lter-arc.20140","Comparison of vole-grazed and ungrazed Eriophorum vaginatum tussock biomass at the 2007 Anaktuvuk River fire scar in 2019","This file contains biomass measurements from vole-grazed and ungrazed Eriophorum vaginatum tussocks taken from the 2007 Anaktuvuk River Fire scar in 2019. Rodent-grazed and ungrazed tussocks were harvested to assess the impact voles have on biomass. Eighteen grazed  tussocks and seven ungrazed tussocks were harvested and taken back to the lab. Ungrazed tussocks were subsampled to make seperation faster. Eight additional ungrzed tussocks were measured in the field and biomass estimates were made using allometry equations based on diameter. The goals of the project were to examine the impact of post-fire changes in plant community composition and structure on habitat suitability and rodent herbivore activity in response to a large, severe, and unprecedented fire in northern Alaska moist acidic tundra.","ecology, ecosphere event, community, animal, community process, environmental process, biodiversity, disturbance, fire, herbivore, vertebrate, herbivory, disturbance, allometry, community dynamics, species diversity, mammal"
"knb-lter-arc.20141","Eriophorum vaginatum rhizome nitrogen content from the 2007 Anaktuvuk River fire scar measured in 2019.","This file contains Eriophorum vaginatum rhizome biomass from a 2017 biomass pluck of previously burned tundra (2007 Anaktuvuk River Fire) and nearby unburned tundra. Rhizome biomass from the pluck was combined with rhizome percent nitrogen estimates (2.47% at the Anaktuvuk River Fire, and 1.05% at the nearby unburned site) to estimate grams of nitrogen per meter squared, to evaluate differences in winter forage quality for the rodent herbivore, Microtus oeconomus. Percent nitrogen estimates were derived from pooled rhizome samples collected from the two sites in late 2018. The goals of the project were to examine the impact of post-fire changes in plant community composition, nutrient quality and structure on habitat suitability and rodent herbivore activity in response to a large, severe, and unprecedented fire in northern Alaska moist acidic tundra.","biogeochemistry, ecology, ecosphere event, community, environmental process, nitrogen cycle, nutrient, biodiversity, disturbance, fire, herbivore, disturbance, nitrogen, community dynamics, species diversity"
"knb-lter-arc.20143","Factorial experiment to test effects of food availability and temperature on slimy sculpin (Cottus cognatus) at Toolik Field Station, 2018","We used a fully factorial experiment to test effects of food availability and temperature (7.6, 12.7 and 17.4 degrees C; 50 days) on growth, consumption, respiration, and excretion of slimy sculpin (Cottus cognatus).","ecology, meteorology, aquatic, animal, biological process, manipulation process, physiological process, biodiversity, temperature, freshwater, lake, vertebrate, growth, warming, respiration, trophic dynamics, fish"
"knb-lter-arc.20145","Habitat use, consumption, and growth  by slimy sculpin (Cottus cognatus) held under different levels of temperature at Toolik Field Station 2019","We tested effects of temperature (12 and 19.3 degrees C; 27 days) on habitat use, consumption, and growth of slimy sculpin (Cottus cognatus).  To measure temperature selection by sculpin, we connected two 5.7 L tanks with a PVC pipe that was passable by sculpin (n = 12 tanks). We heated one side of the tank to 12 C and the other to 19.3 C using aquarium heaters.","ecology, meteorology, aquatic, animal, biological process, manipulation process, biodiversity, temperature, freshwater, lake, vertebrate, growth, warming, trophic dynamics, fish"
"knb-lter-arc.20146","Invertebrate Community Asemblage from the Arctic LTER Upper Kuparuk River Reference (2001-2012) and  Fertilized Reach (2002-2016), Toolik Field Station, Alaska","Surber sampler (25 X 25 cm frame fitted with a 243 um mesh net) was used to sample invertebrates at on the Kuparuk River in Reference (2001-2012) and  Fertilized Reach (2002-2016) reach.","ecology, aquatic, ecosphere event, animal, environmental process, manipulation process, water, biodiversity, freshwater, stream, disturbance, invertebrate, disturbance, fertilization, fresh water, community dynamics"
"knb-lter-arc.20147","Small mammal structure cover collected at Team Vole fences near Nome, Toolik Lake, and Utqaigvik, Alaska, summer 2019","Percent cover of tundra vole and brown lemming structures collected from within the Team Vole enclosure/exclosure fences near Nome, Toolik, Utqiagvik, AK 2019.","ecology, experiment, community, animal, biodiversity, field manipulation, herbivore, vertebrate, plant cover, enclosure, exclosure, mammal"
"knb-lter-arc.20148","Soil and plant biogeochemical and soil temperature variables collected at brown lemming (Lemmus trimucronatus) and tundra vole (Microtus oeconomus) structure sties near Nome, Toolik Lake, and Utqaigvik, Alaska, summer 2018-2020","Soil and plant sampling analysis under small mammal-built structures and controls sites from near the Team Vole fences: Nome, Toolik, Utqiagvik, AK 2018-2020.","meteorology, soil science, experiment, community, animal, temperature, soil temperature, field manipulation, herbivore, vertebrate, exclosure, mammal"
"knb-lter-arc.20149","Model Simulations of The Effects of Shifts in High-frequency Weather Variability (No Long-term Weather Trend) Control Carbon Loss from Land to the Atmosphere, Toolik Lake, Alaska, 2022-2122","Climate change is increasing extreme weather events, but effects on high-frequency weather variability and the resultant impacts on ecosystem function are poorly understood.  We assessed ecosystem responses of arctic tundra to changes in day-to-day weather variability usinga biogeochemical modeland stochastic simulations of daily temperature, precipitation, and light.  Changes in weather variability altered ecosystem carbon, nitrogen, and phosphorus stocks and cycling rates.  Some responses of processes (e.g., respiration) were inconsistent with expectations, indicating that whole-ecosystem interactions and feedbacks moderate or even reverse responses to weather variability.  More weather variability led to greater carbon losses from land to atmosphere, and less variability led to higher carbon sequestration on land.  The magnitude of response to weather variability was similar to that predicted from climate mean trend effects.This dataset consists of the MEL parameter file, driver files and output files for simulations without a long term weathertrend.","biogeochemistry, meteorology, ecosphere event, model, biogeochemical process, biological process, environmental process, hydrologic process, measurement process, physiological process, air, carbon, nitrogen cycle, nutrient, phosphorus cycle, light, precipitation, temperature, weather, disturbance, simulation, carbon, nutrient, production, disturbance, precipitation, modeling, simulation, respiration, atmosphere, nitrogen, phosphorus, primary production"
