"packageid","title","abstract","new_keywords"
"knb-lter-ntl.275","North Temperate Lakes LTER: Northern Wisconsin Lake Resident Survey 2005, 2008, 2012","The purpose of this survey was to understand what lake characteristics people value most, what activities they enjoy most, and what they expect for the future of northern Wisconsin lakes. Questions covered aspects such as the property search process individuals went through leading up to their purchase of lakeshore property in Vilas County WI, what activities the individual's household participate in on lakes in Vilas County WI, their attitude about the future of their lake, their perception of the current state of their lake, and lake qualities they would like improved on their lake. Demographics of the respondents and background information about their lake were also collected. Two types of surveying methodologies were used for this survey, one being an internet-based survey, while the other was a mail survey. Surveys were conducted in 2005 and repeated in 2008.","ecology, sociology, aquatic, human dominated, survey, human, biodiversity, freshwater, lake, urban, plant cover"
"knb-lter-ntl.276","Trout Lake USGS Water, Energy, and Biogeochemical Budgets (WEBB) Stream Data
      1975-2013"," This data was collected by the United States Geological Survey (USGS) for the Water,        Energy, and Biogeochemical Budget Project. The data set is primarily composed of water        chemistry variables, and was collected from four USGS stream gauge stations in the Northern        Highland Lake District of Wisconsin, near Trout Lake. The four USGS stream gauge stations        are Allequash Creek at County Highway M (USGS-05357215), Stevenson Creek at County Highway M        (USGS-05357225), North Creek at Trout Lake (USGS-05357230), and the Trout River at Trout        Lake (USGS-05357245), all near Boulder Junction, Wisconsin. The project has collected        stream water chemistry data for a maximum of 36 different chemical parameters,. and three        different physical stream parameters: temperature, discharge, and gauge height. All water        chemistry samples are collected as grab samples and sent to the USGS National Water Quality        Lab in Denver, Colorado. There is historic data for Stevenson Creek from 1975-1977, and then        beginning again in 1991. The Trout Lake WEBB project began during the summer of 1991 and        sampling of all four sites continues to date. ","biogeochemistry, ecology, geology, geomorphology, hydrology, meteorology, aquatic, human dominated, field method, survey, biogeochemical process, environmental process, hydrologic process, measurement process, landform, water, calcium, carbon, cation, chloride, conductivity, iron, isotope, magnesium, nitrogen cycle, inorganic matter, nutrient, organic matter, oxygen, phosphorus cycle, potassium, salinity, silicon, sodium, sulfur cycle, water biogeochemistry, aquatic ecology, discharge, stage height, water level, temperature, freshwater, lake, stream, road, monitoring, water sample, carbon, mineralization, nitrogen, nutrient, deposition, discharge, streamflow, monitoring, road, fresh water, ground water, bicarbonate, ammonium, ammonia, nitrate, nitrogen fixation, nitrogen, inorganic nutrient, phosphorus, phosphate, silica, sulfur, sulfate, sulfide, water quality, limnology, stream ecology, grab sample"
"knb-lter-ntl.277","Fluxes project at North Temperate Lakes LTER: Random lake survey 2004","The overarching goal of this project is to understand carbon and nutrient cycles for a				landscape on which terrestrial and freshwater systems are intimately connected in multiple				and reciprocal ways. In the Northern Highlands region of Wisconsin, they are studying a				spatially complex landscape in which water features make up almost half of the land area,				with wetlands (27% of land surface) and lakes (13%) both prevalent throughout the region,				interspersed in upland forests. Weather and limnological data from a set of 170 lakes in the				NHLD samples summer 2004. The sampled lakes were from a random stratified subsample (N=300				of 7588 total) of all the lakes in the NHLD. ","biogeochemistry, ecology, meteorology, aquatic, terrestrial, survey, biogeochemical process, water, calcium, carbon, chloride, iron, magnesium, nitrogen cycle, nutrient, oxygen, phosphorus cycle, potassium, sodium, sulfur cycle, water biogeochemistry, aquatic ecology, temperature, weather, freshwater, lake, wetland, forest, nutrient, fresh water, nitrogen, phosphorus, sulfate"
"knb-lter-ntl.278","Cascade Project at North Temperate Lakes LTER cross-lakes comparison carbon Data 1988 - 2007","          Data on dissolved organic and inorganic carbon as well as particulate organic matter and the partial pressure of CO2. Samples were collected with a Van Dorn bottle. Organic samples were collected from the epilimnion, metalimnion, and hypolimnion. Inorganic samples were collected at depths corresponding to 100%, 50%, 25%, 10%, 5%, and 1% of surface irradiance, as well as one sample from the hypolimnion. Samples for the partial pressure of CO2 were collected from two meters above the lake surface (air) and just below the lake surface (water).        ","biogeochemistry, ecology, meteorology, aquatic, air, carbon, nitrogen cycle, organic matter, aquatic ecology, radiation, freshwater, lake, air, nitrogen, limnology, irradiance"
"knb-lter-ntl.279","WDNR Yahara Lakes Fisheries: Fish Lengths and Weights 1987-1998","These data were collected by the Wisconsin Department of Natural Resources (WDNR) from 1987-1998. Most of these data (1987-1993) precede 1995, the year that the University of Wisconsin NTL-LTER program took over sampling of the Yahara Lakes. However, WDNR data collected from 1997-1998 (unrelated to LTER sampling) is also included. In 1987 a joint project by the WDNR and the University of Wisconsin-Madison, Center for Limnology (CFL) was initiated on Lake Mendota. The project involved biomanipulation of fish communities within the lake, which was acheived by stocking game fish species (northern pike and walleye). The goal was to induce a trophic cascade that would improve the water clarity of Lake Mendota. See Lathrop et al. 2002. Stocking piscivores to improve fishing and water clarity: a synthesis of the Lake Mendota biomanipulation project. Freshwater Biology 47, 2410-2424. In collecting these data, the objective was to gather population data and monitor populations to track the progress of the biomanipulation. The data is dominated by an assesssment of the game fishery in Lake Mendota, however other Yahara Lakes and non-game fish species are also represented. A combination of gear types was used to gather the population data including boom shocking, fyke netting, mini-fyke netting, seining, and gill netting. Not every sampling year includes length and weight data from all gear types. The WDNR also carried out randomized, access-point creel surveys to estimate fishing pressure, catch rates, harvest, and exploitation rates. Five data files each include length-weight data, and are organized by the type of gear or method which was used to collect the data: 1) fyke, mini-fyke, and seine netting 2) boom shocking 3) gill netting (1993 only) 4)walleye age as determined by scale and spine analysis (1987 only), and 5) creel survey. The final data file contains creel survey information: number of anglers fishing the shoreline, and number of anglers that started and completed trips from public and private access points. &#13;","biogeochemistry, biology, ecology, sociology, taxonomy, aquatic, coastal, ecosphere event, phenological event, experiment, field method, survey, community, ecosystem, population, algae, animal, community, plankton, biological process, community process, environmental process, manipulation process, measurement process, water, oxygen, water biogeochemistry, aquatic ecology, biodiversity, freshwater, lake, littoral, disturbance, recruitment, monitoring, consumer, food web, predator, population dynamics, invertebrate, vertebrate, nekton, phytoplankton, zooplankton, growth, speciation, predation, species interaction, survival, disturbance, monitoring, fresh water, water quality, water clarity, limnology, abundance, community dynamics, species diversity, species richness, trophic dynamics, fish, predator"
"knb-lter-ntl.28","North Temperate Lakes LTER: Macrophyte Richness - Trout Lake 1993 - current","          These data are collected to document and characterize the submersed macrophytes of Trout Lake, to evaluate the long-term stability of this component, and to interface with investigations of other compartments of the ecosystem. Four sites along the shoreline of Trout Lake have been sampled annually in August along permanent line transects. These data are quadrat level data. This dataset includes a row for every quadrat sampled. The RICHNESS field contains the number of species present (set to zero if the quadrat was empty). If a row is missing, that quadrat was not sampled Sampling Frequency: annually during summer Number of sites: 4        ","ecology, aquatic, coastal, field method, ecosystem, population, plant, biological process, biodiversity, freshwater, lake, littoral, transect, macrophyte, production, species diversity, species richness, primary production"
"knb-lter-ntl.281","River Nutrient Uptake and Transport at North Temperate Lakes LTER (2005-2011)","These data were collected by Stephen Michael Powers and collaborators for his Ph.d.				research, documented in his dissertation: River Nutrient Uptake and Transport Across				Extremes in Channel Form and Drainage Characteristics. A major goal of this research was to				better understand how ecosystem form and landscape setting dictate aquatic biogeochemical				functioning and elemental transport through rivers. To achieve this goal, major and minor				ions were measured in both northern and southern Wisconsin streams located in a variety of				land use settings. In total, 27 different streams were sampled at 104 different stations				(multiple stations per system) from both groundwater and surface water sources. Organic and				inorganic carbon and nitrogen pools were also measured in northern and southern Wisconsin				streams. The streams that were sampled in northern Wisconsin flow through wetland				ecosystems. In sampling such streams, the goal was to better understand how wetland				ecosystems influence river nutrient deliveries. There is a large amount of stream chemistry				data for Big Spring Creek, WI; where the influence of a small reservoir on solute				transportation and transformation was studied in an agricultural watershed. All stream				chemistry data is incorporated in a single data file, Water Chemistry 2005-2011. While the				data is not included in the dissertation, a sediment core study was also done in the small				reservoir and channel of Big Spring (BS) Creek, WI. The results of this study are featured				in three data tables: BS Creek Sediment Core Analysis, BS Creek Sediment Core Chemistry, and				BS Creek Longitudinal Profile. Finally, two data tables list the geospatial information of				sampling sites for stream chemistry and sediment coring in Big Spring Creek. 				Documentation: Powers, S.M., 2012. River nutrient uptake and transport across extremes in				channel form and drainage characteristics. ProQuest Dissertations and Theses. The University				of Wisconsin - Madison, United States -- Wisconsin, p. 140.  ","agriculture, biogeochemistry, biogeography, ecology, geography, geomorphology, history, hydrology, meteorology, sociology, soil science, aquatic, human dominated, terrestrial, ecosphere event, device, model, survey, ecosystem, human, biogeochemical process, environmental process, geological process, hydrologic process, manipulation process, measurement process, layer, sediment, soil, water, landform, carbon, cation, chloride, conductivity, nitrogen cycle, inorganic matter, nutrient, organic matter, oxygen, phosphorus cycle, soil biogeochemistry, water biogeochemistry, aquatic ecology, biodiversity, landcover, landuse, acretion, sedimentation, landscape change, landuse history, discharge, temperature, soil moisture, freshwater, stream, wetland, agricultural, flood plain, riparian, disturbance, sensor, carbon, mineralization, nitrogen, nutrient, deposition, disturbance, accretion, sedimentation, discharge, drainage, runoff, streamflow, fertilization, modeling, hyporheic zone, mesic soil, fresh water, ground water, watershed, ammonium, denitrification, nitrate, nitrogen fixation, nitrogen, inorganic nutrient, phosphorus, phosphate, soil solution chemistry, water quality, water clarity, limnology, stream ecology, density, plant cover"
"knb-lter-ntl.282","Additional Daily Meteorological Data for Madison Wisconsin (1884-2010)","These data are in addition to ""Madison Wisconsin Daily Meteorological Data 1869-current."" Additional variables added include: daily cloud cover, wind, solar radiation, vapor pressure, dew point temperature, total atmospheric pressure, and average relative humidity for Madison, Wisconsin. In addition, the adjustment factors which were applied on a given date to calculate the adjusted parameters in ""Madison Wisconsin Daily Meteorological Data 1869-current"" are also included in these data. Raw data, in English units, were assembled by Douglas Clark - Wisconsin State Climatologist. Data were converted to metric units and adjusted for temporal biases by Dale M. Robertson. For adjustments applied to various parameters see Robertson, 1989 Ph.D. Thesis UW-Madison. Adjusted data represent the BEST estimated daily data and may be raw data. Data collected at Washburn observatory, 8-1-1883 to 9-30-1904. Data collected at North Hall, 10-1-1904 to 12-31-1947 Data collected at Truax Field (Admin BLDG), 1-1-1948 to 12-31-1959. Data collected at Truax Field, center of field, 1-1-1960 to Present. Much of the data after 1990 were obtained in digital form from Ed Hopkins, UW-Meteorology. Data starting in 2002-2005 were obtained from Sullivan at http://www.weather.gov/climate/index.php?wfo=mkx%20 ,then go to CF6 and download monthly data to Madison_sullivan_conversion. Relative humidity data was obtained from 1986 to 1995 from CD's at the State Climatologist's Office. Since Robertson (1989) adjusted all historical data to that collected prior to 1989; no adjustments were applied to the recent data except for wind and estimated vapor pressure. Wind after January 1997, and only wind from the southwest after November 2007, was extended by Dale M. Robertson and Yi-Fang ""Yvonne"" Hsieh, see methods. Estimated vapor pressure after April 2002 was updated by Yvonne Hsieh, see methods.","climatology, ecology, history, hydrology, meteorology, sociology, human dominated, atmospheric event, field method, spatial method, ecosystem, human, environmental process, hydrologic process, measurement process, air, water, landform, aquatic ecology, biodiversity, evaporation, temperature, atmospheric pressure, precipitation, radiation, relative humidity, snow, weather, wind, urban, frost, storm, monitoring, imagery, accumulation, advection, precipitation, snow accumulation, monitoring, remote sensing, air, atmosphere, snow, watershed, limnology, plant cover, air temperature, wind speed, remote sensing"
"knb-lter-ntl.283","Lake Mendota at North Temperate Lakes LTER: Snow and Ice Depth 2009-2010","Ice core data collected by Yi-Fang (Yvonne) Hsieh and collaborators for her PhD project, Modeling Ice Cover and Water Temperature of Lake Mendota. Part of the project was the development of a 3D hydrodynamic-ice model that simulated both temporal and spatial distributions of ice cover on Lake Mendota for the winter 2009-2010. The parameters from these ice core data were used as model inputs to run model simulations. Parameters measured include: blue ice, white ice, snow depth, and total ice. On February 13, 2009, ice cores were taken on Lake Mendota at four different stations. From January 14, 2010 through March 3, 2010 ice cores were taken on Lake Mendota at 31 different stations. In addition, ice cores were taken on other Yahara Lakes during February of 2009: Lake Kegonsa (4 stations_February 6), Lake Waubesa (4 stations_February 7), Lake Wingra (2 stations_February 8), and Lake Monona (4 stations_February 8). Only total ice measurements are reported for 2009. Included in this data set are the ice core data, and geospatial information for ice coring stations. Documentation: Hsieh, Y.-F., 2012a. Modeling ice cover and water temperature of Lake Mendota. ProQuest Dissertations and Theses. The University of Wisconsin - Madison, United States -- Wisconsin, p. 157.","biology, climatology, ecology, geography, history, hydrology, meteorology, phenology, sociology, aquatic, coastal, human dominated, atmospheric event, ecosphere event, field method, model, spatial method, survey, ecosystem, human, environmental process, hydrologic process, manipulation process, measurement process, air, water, aquatic ecology, biodiversity, landscape change, bathymetry, evaporation, temperature, light, precipitation, radiation, relative humidity, snow, wind, freshwater, lake, littoral, urban, frost, disturbance, ice core, monitoring, simulation, geographic information system, imagery, mapping, accumulation, advection, disturbance, ice, precipitation, snow accumulation, water balance, thinning, mapping, mass balance, modeling, simulation, monitoring, remote sensing, air, fresh water, ice, snow, snow depth, limnology, plant cover, air temperature, irradiance, remote sensing, ice thickenss"
"knb-lter-ntl.285","Fluxes project at North Temperate Lakes LTER: Spatial Metabolism Study 2007","Data from a lake spatial metabolism study by Matthew C. Van de Bogert for his Phd project, ""Aquatic ecosystem carbon cycling: From individual lakes to the landscape."" The goal of this study was to capture the spatial heterogeneity of within-lake processes in effort to make robust estimates of daily metabolism metrics such as gross primary production (GPP), respiration (R), and net ecosystem production (NEP). In pursuing this goal, multiple sondes were placed at different locations and depths within two stratified Northern Temperate Lakes, Sparkling Lake (n=35 sondes) and Peter Lake (n=27 sondes), located in the Northern Highlands Lake District of Wisconsin and the Upper Peninsula of Michigan, respectively.Dissolved oxygen and temperature measurements were made every 10 minutes over a 10 day period for each lake in July and August of 2007. Dissolved oxygen measurements were corrected for drift. In addition, conductivity, temperature compensated specific conductivity, pH, and oxidation reduction potential were measured by a subset of sondes in each lake. Two data tables list the spatial information regarding sonde placement in each lake, and a single data table lists information about the sondes (manufacturer, model, serial number etc.). Documentation:Van de Bogert, M.C., 2011. Aquatic ecosystem carbon cycling: From individual lakes to the landscape. ProQuest Dissertations and Theses. The University of Wisconsin - Madison, United States -- Wisconsin, p. 156. Also see Van de Bogert, M.C., Bade, D.L., Carpenter, S.R., Cole, J.J., Pace, M.L., Hanson, P.C., Langman, O.C., 2012. Spatial heterogeneity strongly affects estimates of ecosystem metabolism in two north temperate lakes. Limnology and Oceanography 57, 1689-1700.","biogeochemistry, biology, climatology, ecology, geography, geology, meteorology, oceanography, aquatic, coastal, terrestrial, device, field method, model, spatial method, survey, community, ecosystem, algae, biogeochemical process, biological process, community process, environmental process, measurement process, physiological process, air, biomass, water, carbon, chlorophyll, conductivity, nutrient, oxygen, water biogeochemistry, aquatic ecology, biodiversity, light, radiation, temperature, weather, wind, benthos, freshwater, lake, marine, littoral, forest, sensor, monitoring, platform, simulation, geographic information system, consumer, food web, carbon, nutrient, production, extinction, advection, mass balance, modeling, simulation, monitoring, metabolism, photosynthesis, respiration, air, atmosphere, fresh water, water column, limnology, trophic dynamics, mooring buoy, primary production"
"knb-lter-ntl.286","Fluxes project at North Temperate Lakes LTER: Hydrology Scenarios Model Output","A spatially-explicit simulation model of hydrologic flow-paths was developed by Matthew C. Van de Bogert and collaborators for his PhD project, "" Aquatic ecosystem carbon cycling: From individual lakes to the landscape."" The model is coupled with an in-lake carbon model and simulates hydrologic flow paths in groundwater, wetlands, lakes, uplands, and streams. The goal of this modeling effort was to compare aquatic carbon cycling in two climate scenarios for the North Highlands Lake District (NHLD) of northern Wisconsin: one based on the current climate and the other based on a scenario with warmer winters where lakes and uplands do not freeze, hereinafter referred to as the ""no freeze"" scenario. In modeling this ""no freeze"" scenario the same precipitation and temperature data as the current climate model was used, however temperature inputs were artificially floored at 0 degrees Celsius. While not discussed in his dissertation, Van de Bogert considered two other climate scenarios each using the same precipitation and temperature data as the current climate scenario. These scenarios involved running the model after artificially raising and lowering the current temperature data by 10 degrees Celsius. Thus, four scenarios were considered in this modeling effort, the current climate scenario, the ""no freeze"" scenario, the +10 degrees scenario, and the -10 degrees scenario. These data are the outputs of the model under the different scenarios and include average monthly temperature, average monthly rainfall, average monthly snowfall, total monthly precipitation, daily evapotranspiration, daily surface runoff, daily groundwater recharge, and daily total runoff. Note that the results of how temperature inputs influence aquatic carbon cycling under these different scenarios is not included in this data set, refer to Van de Bogert (2011) for this information.Documentation: Van de Bogert, M.C., 2011. Aquatic ecosystem carbon cycling: From individual lakes to the landscape. ProQuest Dissertations and Theses. The University of Wisconsin - Madison, United States -- Wisconsin, p. 156.","biogeochemistry, biology, climatology, ecology, geography, history, hydrology, meteorology, phenology, sociology, aquatic, terrestrial, atmospheric event, ecosphere event, model, community, ecosystem, human, biogeochemical process, biological process, environmental process, hydrologic process, measurement process, physiological process, air, landform, water, carbon, nutrient, organic matter, aquatic ecology, biodiversity, landcover, landuse, landscape change, landuse history, evaporation, water level, temperature, precipitation, snow, weather, freshwater, lake, stream, wetland, forest, frost, storm, disturbance, simulation, food web, carbon, nutrient, emission, production, accumulation, deposition, disturbance, evapotranspiation, ice, infiltration, precipitation, runoff, snow accumulation, water balance, mass balance, modeling, simulation, transpiration, air, atmosphere, basin, hillslope, fresh water, ground water, ice, snow, snow depth, water table, watershed, limnology, density, forest ecology, plant cover, air temperature"
"knb-lter-ntl.288","North Temperate Lakes LTER Northern Highland Lake District Bathymetry","This data set represents the bathymetry of the seven NTL-LTER primary study lakes                in the Northern Highland Lake District (aka Trout Lake Region). Bathymetry is                encoded as vector contours with a varying contour interval depending on the depth of the lake.","geography, hydrology, aquatic, spatial method, population, bathymetry, freshwater, lake, geographic information system"
"knb-lter-ntl.289","Lake Shoreline in the Contiguous United States","There are millions of lakes, ponds and reservoirs in the United States. Existing        datasets are large and unweildy. With this data product, derived from the US NHD (downloaded        Jan 2013), we summarize at a high level the distribution of lakes across the US.","geography, aquatic, spatial method, population, freshwater, lake, pond, geographic information system"
