"packageid","title","abstract","new_keywords"
"knb-lter-arc.1381","Plant biomass, leaf area, carbon, nitrogen, and phosphorus in wet sedge tundra, 1994, Arctic LTER, Toolik Lake, Alaska.","Plant biomass, leaf area, carbon, nitrogen, and phosphorus were measured in three wet sedge tundra experimental sites. Treatments at each site included factorial NxP and at the Toolik sites greenhouse and shade house. Treatments started in 1985 (Sag site) and in 1988 (Toolik sites).","biogeochemistry, ecosphere event, experiment, plant part, biological process, environmental process, carbon, nitrogen cycle, inorganic matter, nutrient, organic matter, phosphorus cycle, disturbance, greenhouse, leaf, production, disturbance, nitrogen, inorganic nutrient, phosphorus, leaf area, primary production"
"knb-lter-arc.1382","Weights and lengths from retrospective growth analysis of different stem age classes of Betula nana, 1995, Arctic LTER, Toolik Lake, Alaska.","This data file contains the data on weights and lengths from retrospective growth analysis of different stem age classes of Betula nana ramets from the LTER Nutrient and Warming manipulations in tussock tundra at Toolik Lake.","biogeochemistry, ecosphere event, plant part, biological process, environmental process, manipulation process, inorganic matter, nutrient, organic matter, disturbance, stem, growth, production, disturbance, warming, inorganic nutrient, primary production"
"knb-lter-arc.1383","Above ground plant biomass and leaf area of moist acidic tussock tundra 1981 experimental site, Arctic LTER, Toolik Lake, Alaska.1995.","Above ground plant biomass and leaf area were measured in a tussock tundra experimental site. The plots were set up in 1981 and have been harvested in previous years (See Shaver and Chapin Ecological Monographs, 61, 1991 pp.1-31).","biogeochemistry, ecosphere event, plant part, biological process, environmental process, nitrogen cycle, inorganic matter, nutrient, organic matter, phosphorus cycle, disturbance, leaf, production, disturbance, nitrogen, inorganic nutrient, phosphorus, leaf area, primary production"
"knb-lter-arc.1384","Plant biomass in heath tundra experimental plots, 1996, Arctic LTER, Toolik Lake, Alaska.","Plant biomass in arctic heath experimental plots. Plots set up in 1989 with nitrogen, phosphorus, nitrogen plus phosphorus and a shade treatment were harvested for above ground biomass. Root mass was also measured on a smaller subsample.","biogeochemistry, ecosphere event, plant part, biological process, environmental process, biomass, nitrogen cycle, inorganic matter, nutrient, organic matter, phosphorus cycle, disturbance, root, production, disturbance, above ground biomass, nitrogen, inorganic nutrient, phosphorus, primary production"
"knb-lter-arc.1385","Plant biomass in mesic acidic tussock tundra, 1998 15Nitrogen controls, Toolik, Alaska.","Five or six quadrats (20cm x 20cm squares) along a line (block) were collected for plant biomass in mesic tussock tundra. In the lab each quadrat was separated into individual species, new and old aboveground and belowground biomass.","biogeochemistry, ecology, biological process, biomass, nitrogen cycle, organic matter, biodiversity, production, below ground biomass, nitrogen, primary production"
"knb-lter-arc.1386","Plant biomass in moist acidic tussock tundra experimental small mammal exclosures, 1999 Arctic LTER Toolik, Alaska.","Above ground plant and below ground stem biomass was measured in Arctic LTER tussock tundra experimental small mammal exclosures. Treatments included Control, Nitrogen plus Phosphorus with both fenced and unfenced plots. In addition a moist non-acidic tussock tundra site was harvested. Leaf areas were also measured for each quadrat but are in a separate file.","biogeochemistry, ecosphere event, experiment, animal, plant part, biological process, environmental process, nitrogen cycle, inorganic matter, nutrient, organic matter, phosphorus cycle, disturbance, field manipulation, vertebrate, leaf, stem, production, disturbance, nitrogen, inorganic nutrient, phosphorus, exclosure, mammal, leaf area, primary production"
"knb-lter-arc.1387","Plant leaf area in Arctic LTER tussock tundra experimental small mammal exclosures.","Leaf areas were measured on quadrats harvested in Arctic LTER tussock tundra experimental small mammal exclosures. Treatments included Control, Nitrogen plus Phosphorus with both fenced and unfenced plots. In addition a moist non-acidic tussock tundra site was harvested. Biomass was also measured for each quadrat but is in a separate file.","biogeochemistry, ecosphere event, experiment, animal, plant part, biological process, environmental process, nitrogen cycle, inorganic matter, nutrient, organic matter, phosphorus cycle, disturbance, field manipulation, vertebrate, leaf, production, disturbance, nitrogen, inorganic nutrient, phosphorus, exclosure, mammal, leaf area, primary production"
"knb-lter-arc.1388","Relative percent cover was measured for plant species on Arctic LTER experimental plots in moist acidic and moist non-acidic tundra, Toolik Field Station, Alaska, Arctic LTER 1999.","Relative percent cover was measured for plant species on Arctic LTER experimental plots in moist acidic and moist non-acidic tundra, Toolik Field Station, Alaska, Arctic LTER 1999.","ecology, ecosphere event, environmental process, biodiversity, disturbance, disturbance, abundance, plant cover"
"knb-lter-arc.1389","Leaf area for select species was measured in arctic tundra experimental sites from late June into early August,Toolik Field Sattion, Alaska, Arctic LTER 2000.","Leaf area for select species was measured in arctic tundra experimental sites from late June into early August. Measurements were made in acidic and non acidic tussock tundra and in shrub tundra in control and fertilized plots.","biogeochemistry, ecology, ecosphere event, plant, plant part, biological process, environmental process, manipulation process, inorganic matter, nutrient, organic matter, biodiversity, disturbance, vascular plant, leaf, production, disturbance, fertilization, inorganic nutrient, shrub, leaf area, primary production"
"knb-lter-arc.1390","Above ground plant biomass in a mesic acidic tussock tundra experimental site 2000, Arctic LTER, Toolik Lake, Alaska.","Above ground plant biomass and leaf area were measured in a tussock tundra experimental site. The plots were set up in 1981 and have been harvested in previous years (See Shaver and Chapin Ecological Monographs, 61(1), 1991 pp.1-31.) This file contains the biomass numbers for each harvested quadrat and per cent carbon and nitrogen summaries for control and fertilized plots. Leaf area data is in 2000gsttLA","biogeochemistry, ecosphere event, plant part, biological process, environmental process, manipulation process, carbon, nitrogen cycle, inorganic matter, nutrient, organic matter, disturbance, leaf, production, disturbance, fertilization, nitrogen, inorganic nutrient, leaf area, primary production"
"knb-lter-arc.1391","Arctic LTER 2000: Relative percent cover was measured for plant species on Arctic LTER experimental plots in moist acidic and moist non-acidic tundra.","Relative percent cover was measured for plant species on Arctic LTER experimental plots in moist acidic and moist non-acidic tundra.","ecology, ecosphere event, environmental process, biodiversity, disturbance, disturbance, abundance, plant cover"
"knb-lter-arc.1392","Aboveground plant and belowground stem biomass were measured in moist acidic and moist non-acidic tussock tundra experimental plots, Toolik Field Station, Alaska, Arctic LTER 2000.","Aboveground plant and belowground stem biomass were measured in moist acidic and moist non-acidic tussock tundra experimental plots. Treatments at the acidic site include control and nitrogen (N) plus phosphorus (P) amendments; treatments at the non-acidic site include N, P, N+P, greenhouse warming, and greenhouse+N+P. Note: Version 8 corrected an error where Carex vaginatawas listed twice under treatment of ""Nitrogen Phosphorus"". The tissues with 8quadratswere""Greenhouse"" treatment.","biogeochemistry, ecosphere event, experiment, plant part, biological process, environmental process, manipulation process, nitrogen cycle, inorganic matter, nutrient, organic matter, phosphorus cycle, disturbance, greenhouse, stem, production, disturbance, warming, nitrogen, inorganic nutrient, phosphorus, primary production"
"knb-lter-arc.1393","Percent carbon, percent nitrogen, del13C and del15N of above ground plant and belowground stem biomass samples from experimental plots in moist acidic and moist non-acidic tundra, 2000, Arctic LTER, Toolik Lake, Alaska.","Percent carbon, percent nitrogen, del13C and del15N were measured from above ground plant and belowground stem biomass samples from experimental plots in moist acidic and moist non-acidic tundra. Biomass data are in 2000lgshttbm.dat.","biogeochemistry, ecosphere event, plant part, biological process, environmental process, carbon, nitrogen cycle, inorganic matter, nutrient, organic matter, phosphorus cycle, disturbance, stem, production, disturbance, nitrogen, inorganic nutrient, phosphorus, primary production"
"knb-lter-arc.1394","Biomass, nitrogen and carbon of plants in the Arctic LTER experimental wet sedge tundra experimental sites, 2001, Toolik Lake, Alaska.","Biomass, nitrogen and carbon of plants in the Arctic LTER experimental wet sedge tundra experimental sites, 2001, Toolik Lake, Alaska.. Treatments at each site included factorial NxP, greenhouse and shade house and were begun in 1985 (Sag site) or in 1988 (Toolik sites).","biogeochemistry, ecosphere event, experiment, biological process, environmental process, carbon, nitrogen cycle, inorganic matter, nutrient, organic matter, phosphorus cycle, disturbance, greenhouse, production, disturbance, nitrogen, inorganic nutrient, phosphorus, primary production"
"knb-lter-arc.1395","Arctic LTER 2001: Relative percent cover was measured for plant species on Arctic LTER experimental plots in moist acidic and moist non-acidic tundra.","Relative percent cover was measured for plant species on Arctic LTER experimental plots in moist acidic and moist non-acidic tundra.","ecology, ecosphere event, environmental process, biodiversity, disturbance, disturbance, abundance, plant cover"
"knb-lter-arc.1396","Above ground plant and belowground stem biomass in moist acidic and non-acidic tussock tundra experimental sites, 2001, Arctic LTER, Toolik Lake, Alaska.","Above ground plant and belowground stem biomass was measured in moist acidic and non-acidic tussock tundra experimental sites. Treatments sampled were control plots and plots amended with nitrogen and phosphorus.","biogeochemistry, ecosphere event, plant part, biological process, environmental process, nitrogen cycle, inorganic matter, nutrient, organic matter, phosphorus cycle, disturbance, stem, production, disturbance, nitrogen, inorganic nutrient, phosphorus, primary production"
"knb-lter-arc.1397","Percent carbon and percent nitrogen of above ground plant and belowground stem biomass samples from experimental plots in moist acidic and moist non-acidic tundra, 2001, Arctic LTER, Toolik Lake, Alaska.","Percent carbon and percent nitrogen were measured from above ground plant and belowground stem biomass samples from experimental plots in moist acidic and moist non-acidic tundra. Biomass data are in 2001lgshttbm.dat.","biogeochemistry, ecosphere event, plant part, biological process, environmental process, carbon, nitrogen cycle, inorganic matter, nutrient, organic matter, phosphorus cycle, disturbance, stem, production, disturbance, nitrogen, inorganic nutrient, phosphorus, primary production"
"knb-lter-arc.1398","Above ground plant and below ground stem biomass in the Arctic LTER acidic tussock tundra experimental plots, 2002, Toolik Lake, Alaska.","Above ground plant and below ground stem biomass and their carbon and nitrogen content was measured in the Arctic LTER moist acidic tussock tundra experimental plots(MAT89). Treatments included control, nitrogen plus phosphorus amended plots for either 6 or 13 years and vole exclosure plots with or without amends of nitrogen and phosphorus.","biogeochemistry, ecosphere event, experiment, plant part, biological process, environmental process, carbon, nitrogen cycle, inorganic matter, nutrient, organic matter, phosphorus cycle, disturbance, field manipulation, stem, production, disturbance, nitrogen, inorganic nutrient, phosphorus, exclosure, primary production"
"knb-lter-arc.1399","Relative percent cover was measured for plant species on Arctic LTER experimental plots in moist acidic and moist non-acidic tundra, Toolik Field Station, Alaska 2002","Relative percent cover was measured for plant species on Arctic LTER experimental plots in moist acidic and moist non-acidic tundra.","ecology, ecosphere event, environmental process, biodiversity, disturbance, disturbance, abundance, plant cover"
"knb-lter-arc.1400","Biomass in wet sedge tundra near the Atigun River crossing of the Dalton Highway, North Slope AK, 1982.","Biomass in wet sedge tundra near the Atigun River crossing of the Dalton Highway, North Slope AK. There were three harvests; Late May-early June; Late July-early August; Late August-early September. See Shaver and Chapin (Ecological Monographs, 61, 1991 pp.1-31).","biogeochemistry, ecosphere event, biological process, environmental process, landform, calcium, magnesium, nitrogen cycle, inorganic matter, nutrient, organic matter, phosphorus cycle, potassium, disturbance, production, disturbance, hillslope, nitrogen, inorganic nutrient, phosphorus, primary production"
"knb-lter-arc.1401","Biomass in heath tundra near Toolik Lake North Slope AK (68 degrees 38N, 149derees 34W), 1982.","Biomass in heath tundra near Toolik Lake North Slope AK (68 degrees 38N, 149derees 34W). .There were three harvests;Late May-early June; Late July-early August; Late August-early September. See Shaver and Chapin (Ecological Monographs, 61(1), 1991 pp.1-31.","biogeochemistry, ecosphere event, biological process, environmental process, landform, calcium, magnesium, nitrogen cycle, inorganic matter, nutrient, organic matter, phosphorus cycle, potassium, disturbance, production, disturbance, hillslope, nitrogen, inorganic nutrient, phosphorus, primary production"
"knb-lter-arc.1402","Biomass in shrub tundra near Toolik Lake North Slope AK (68 degrees 38N, 149derees 34W),1982.","Biomass in shrub tundra near Toolik Lake North Slope AK (68 degrees 38N, 149derees 34W). There were three harvests; Late May-early June; Late July-early August; Late August-early September. See Shaver and Chapin (Ecological Monographs, 61(1), 1991 pp.1-31.","biogeochemistry, ecosphere event, plant, biological process, environmental process, landform, calcium, magnesium, nitrogen cycle, inorganic matter, nutrient, organic matter, phosphorus cycle, potassium, disturbance, vascular plant, production, disturbance, hillslope, nitrogen, inorganic nutrient, phosphorus, shrub, primary production"
"knb-lter-arc.1403","Arctic LTER 1982: Biomass in tussock tundra near Toolik Lake North Slope AK (68 degrees 38N, 149derees 34W).","Biomass in tussock tundra near Toolik Lake North Slope AK (68 degrees 38N, 149derees 34W). There were three harvests;Late May-early June; Late July-early August; Late August-early September. See Shaver and Chapin (Ecological Monographs, 61(1), 1991 pp.1-31.","biogeochemistry, ecosphere event, biological process, environmental process, landform, calcium, magnesium, nitrogen cycle, inorganic matter, nutrient, organic matter, phosphorus cycle, potassium, disturbance, production, disturbance, hillslope, nitrogen, inorganic nutrient, phosphorus, primary production"
"knb-lter-arc.1404","Quadrats were harvested for aboveground biomass from eight plots within a tussock, watertrack, and snowbed community at 3 sites - acidic tundra and nonacidic tundra near Arctic LTER Toolik Plots and acidic tundra near Sagwon,Arctic LTER 1997.","Quadrats were harvested for aboveground biomass from eight plots within a tussock, watertrack, and snowbed community at 3 sites - acidic tundra near Toolik (site of acidic LTER plots), nonacidic tundra near Toolik Lake(site of non-acidic LTER plots), and acidic tundra near Sagwon. All vascular species were sorted, divided into new and old growth, dried, and weighed. Lichens were separated by genus in all quadrats. In half of the quadrats (n=4), mosses were separated by species. Moss and lichen data are presented by species elsewhere (see 97lgmosslichen.txt).","biogeochemistry, ecology, plant, biological process, biomass, organic matter, biodiversity, moss, production, above ground biomass, community dynamics, species diversity, primary production"
"knb-lter-arc.1405","A harvest was conducted to determine productivity of rare species not found in at least 4 quadrats per site in a separate small quadrat aboveground biomass harvest, Arctic LTER 1997.","A harvest was conducted to determine productivity of rare species not found in at least 4 quadrats per site in a separate small quadrat aboveground biomass harvest (see 97lg3sbm.txt). Harvests occurred in a tussock, watertrack, and snowbed community at 3 sites - acidic tundra near Toolik (site of acidic LTER plots), nonacidic tundra near Toolik Lake(site of non-acidic LTER plots), and acidic tundra near Sagwon. Moss and lichen data are presented by species elsewhere (see 97lgmosslichen).","biogeochemistry, ecology, biological process, biomass, organic matter, biodiversity, production, above ground biomass, community dynamics, species diversity, primary production"
"knb-lter-arc.1406","Measurements of Leaf area, foliar C and N for 14 sites along a transect down the Kuparuk River basin, summer 1997, North Slope, Alaska.","1997 measurements of Leaf area, foliar C and N for 14 sites along a transect down the Kuparuk River basin, North Slope, Alaska.","biogeochemistry, field method, plant part, biological process, landform, nitrogen cycle, inorganic matter, nutrient, organic matter, phosphorus cycle, transect, leaf, production, hillslope, nitrogen, inorganic nutrient, phosphorus, leaf area, primary production"
"knb-lter-arc.1407","Foliar nutrients (N, P, K, Ca, Mg, Al) for dominant species on moist acidic and non-acidic tundra, Arctic LTER, Toolik Field Station , Alaska, 1999.","Foliar nutrients (N, P, K, Ca, Mg, Al) for dominant species on moist acidic and non-acidic tundra, Arctic LTER, Toolik Field Station , Alaska, 1999.","biogeochemistry, ecology, ecosphere event, plant part, biological process, environmental process, inorganic matter, nutrient, organic matter, biodiversity, disturbance, leaf, production, disturbance, inorganic nutrient, primary production"
"knb-lter-arc.1408","Foliar and litter nutrients and retranslocation efficiencies (N, P, K, Ca, Mg, Al) for dominant species on moist acidic and non-acidic tundra, Arctic LTER, Toolik Field Station , Alaska, 1999.","Foliar and litter nutrients and retranslocation efficiencies (N, P, K, Ca, Mg) for dominant species on moist acidic and non-acidic tundra, Arctic LTER, Toolik Field Station , Alaska, 1999.","biogeochemistry, ecology, ecosphere event, plant part, biological process, environmental process, inorganic matter, nutrient, organic matter, biodiversity, disturbance, leaf, production, translocation, disturbance, inorganic nutrient, primary production"
"knb-lter-arc.1409","Long-term Carbon and Nitrogen, and Phosphorus Dynamics of Leaf and Fine Root Litter project (LIDET-Long-term Intersite Decomposition Experiment Team) data for the ARC, Arctic LTER. 1990 to 2000.","This file is from the Long-term Carbon and Nitrogen, and Phosphorus Dynamics of Leaf and Fine Root Litter project (LIDET-Long-term Intersite Decomposition Experiment Team). This file contains only the Arctic LTER data. In particular the mass looses over the ten year study. Three types of fine roots (graminoid, hardwood, and conifer), six types of leaf litter (which ranged in lignin/nitrogen ratio from 5 to 75), and wooden dowels were used for litter incubations over a ten year period.","biogeochemistry, field method, plant part, environmental process, measurement process, carbon, decomposition, nitrogen cycle, organic matter, phosphorus cycle, litterbag, leaf, root, wood, decomposition, incubation, nitrogen, phosphorus, leaf litter"
"knb-lter-arc.1410","Yearly Eriophorum vaginatum Flowering data along a transect on the Haul Road, Fairbanks to Prudhoe Bay, AK 1979 to present.","Eriophorum vaginatum Flowering data along a transect on the Haul Road, Fairbanks to Prudhoe Bay, AK.","phenological event, field method, plant part, flowering, transect, flower"
"knb-lter-arc.1411","Numbers of Eriophorum vaginatum inflorescences, both unclipped and clipped by small mammals, were counted in experimental small mammal exclosure plots, Arct LTER mosit acidic tussock site, Toolik Field Station, Alaska, 1997 to present.","Numbers of Eriophorum vaginatum inflorescences, both unclipped and clipped by small mammals, were counted in experimental plots. The plots are setup in moist acidic tussock tundra near Toolik Field Station, Alaska ((8 degrees 37&#039; 27&quot; N, 149 degrees 36&#039; 27&quot;W) and include fenced exclosures in both fertilized and unfertilized tundra.","ecosphere event, experiment, community, animal, environmental process, manipulation process, disturbance, field manipulation, herbivore, vertebrate, disturbance, fertilization, exclosure, mammal"
"knb-lter-arc.1412","Seasonal patterns of leaf exsertion, elongation and senescence for Eriophorum vaginatum and Carex bigelowii was measured in mesic tussock tundra sites 1985 to 1986, near Toolik Lake, AK.","Seasonal patterns of leaf exsertion, elongation and senescence for Eriophorum vaginatum and Carex bigelowii was measured in mesic tussock tundra sites near Toolik Lake, AK. In addition, the response of both species to NP fertilizer and to variation in site fertility (after track versus non-track areas) were also assayed and compared. The research was done over two full growing seasons.","ecology, ecosphere event, plant part, biological process, environmental process, manipulation process, biodiversity, disturbance, leaf, production, disturbance, fertilization, primary production"
"knb-lter-arc.1413","Stems were measured, and aged from Ledum palustre and Salix pulchra on LTER Moist Acidic Tussock Tundra 1981 plots summer 1990, Toolik Lake Filed Station, AK.","Stems were measured, and aged from Ledum palustre and Salix pulchra species on treated plots at Toolik Lake, AK. Stem secondary growth in per cent per year was estimated from the slope of weight per unit length vs. age.","ecology, ecosphere event, plant part, biological process, environmental process, landform, biodiversity, disturbance, stem, growth, production, disturbance, hillslope, primary production"
"knb-lter-arc.1414","Data on weights and lengths from retrospective growth analysis of different stem age classes of Betula nana ramets from the Arctic LTER Nutrient and Warming manipulations in mosit acidic tussock tundra at 1995, Toolik Lake, AK.","This data file contains the data on weights and lengths from retrospective growth analysis of different stem age classes of Betula nana ramets from the Arctic LTER Nutrient and Warming manipulations in moist acidic tussock tundra at Toolik Lake.","biogeochemistry, ecosphere event, plant part, biological process, environmental process, manipulation process, nutrient, disturbance, stem, growth, disturbance, warming"
"knb-lter-arc.1415","Leave growth of Eriophorum angustifolium and Carex rotundata was measured in a long-term experimental wet sedge tundra site, Arctic LTER 1996, Toolik Lake, AK.","Leave growth of Eriophorum angustifolium and Carex rotundata was measured in a long-term experimental wet sedge tundra site near Toolik Lake, AK. Experimental treatments at each site included factorial NxP, greenhouse and shadehouse and were begun in 1989 (Toolik sites).","ecosphere event, experiment, plant part, biological process, environmental process, disturbance, greenhouse, leaf, growth, disturbance"
"knb-lter-arc.1416","Phenological stages of deciduous plants were observed at a long term experimental moist acidic tussock tundra site, Arctic LTER 1996 Toolik Lake, AK.","Phenological stages of deciduous plants were observed at a long term experimental moist acidic tussock tundra site (Arctic LTER) near Toolik Field Station, AK. Also, ITEX maximum growth measurements were recorded on August 19th (moist tussock tundra). Experimental treatments at each site included factorial NxP, greenhouse and shadehouse and were begun in 1989. See 96gspheg.html and 96gsphsg. html for phenological data on evergreen and sedge species.","ecology, ecosphere event, experiment, biological process, environmental process, biodiversity, disturbance, greenhouse, growth, disturbance"
"knb-lter-arc.1417","Phenological stages of evergeen plants were observed at a long term experimental moist tussock tundra site (Arctic LTER) 1996 near Toolik Lake, AK.","Phenological stages of evergeen plants were observed at a long term experimental moist acidic tussock tundra (Arctic LTER) in 1996 near Toolik Lake, AK. Also, ITEX maximum growth measurements were recorded on August 19th (moist tussock tundra). Experimental treatments at each site included factorial NxP, greenhouse and shadehouse and were begun in 1989. See 96gsphdc and 96gsphsg for phenological data on deciduous and sedge species.","ecology, ecosphere event, experiment, biological process, environmental process, biodiversity, disturbance, greenhouse, growth, disturbance"
