"packageid","title","abstract","new_keywords"
"knb-lter-arc.10004","Above ground plant biomass in a mesic acidic tussock tundra experimental site from 1982 to 2015 Arctic LTER, Toolik Lake, Alaska.","Above ground plant biomass and leaf area were measured in a moist acidic tussock tundra experimental site. The plots were set up in 1981 and have been harvested in periodical (See Shaver and Chapin Ecological Monographs, 61(1), 1991 pp.1-31. Mack, et al, Nature 2004 431:440-443) This file contains the biomass numbers for each harvested quadrat and per cent carbon and nitrogen summaries for harvests through 2000. Leaf area data is presented in other data files (see http://ecosystems.mbl.edu/arc).","biogeochemistry, ecosphere event, plant part, biological process, environmental process, manipulation process, carbon, nitrogen cycle, inorganic matter, nutrient, organic matter, disturbance, leaf, production, disturbance, fertilization, nitrogen, inorganic nutrient, leaf area, primary production"
"knb-lter-arc.10005","Percent C, Percent N and C:N ratio for leaf samples from ITEX flux survey plots for 2003-2004, Toolik Alaska.","Foliar carbon and nitrogen concentrations of the dominant species from within the ITEX flux survey plots 2003-2004. Plots were located in the Toolik Lake LTER moist acidic tussock experiment plots in Alaska; at Imnavait Creek, Alaska.","biogeochemistry, ecology, plant part, carbon, nitrogen cycle, inorganic matter, nutrient, organic matter, biodiversity, leaf, nitrogen, inorganic nutrient"
"knb-lter-arc.10006","Leaf area, biomass, carbon and nitrogen content by species for harvests taken as part of the ITEX flux survey.","Leaf area, biomass, foliar carbon and nitrogen by species for destructive vegetation harvests. Plots were located in the Toolik Lake LTER fertilization experiment in Alaska; at Imnavait Creek, Alaska; at Paddus, Latnjajaure and the Stepps site near Abisko in northern Sweden; and at various sites in Adventdalen, Svalbard, in Zackenberg valley, Northeast Greenland, and at BEO near Barrow, Alaska. Harvests were taken during the growing seasons 2003 to 2009.","biogeochemistry, ecology, community, community, plant part, biological process, manipulation process, carbon, nitrogen cycle, inorganic matter, nutrient, organic matter, biodiversity, vegetation, vegetation, leaf, production, fertilization, nitrogen, inorganic nutrient, vegetation dynammics, leaf area, primary production"
"knb-lter-arc.10007","NDVI, leaf area index and total foliar N of harvests taken during the ITEX flux survey","Leaf area, biomass, foliar carbon and nitrogen by species for destructive vegetation harvests. Plots were located in the Toolik Lake LTER fertilization experiment in Alaska; at Imnavait Creek, Alaska; at Paddus, Latnjajaure and the Stepps site near Abisko in northern Sweden; and at various sites in Adventdalen, Svalbard, in Zackenberg valley, Northeast Greenland and at BEO near Barrow, Alaska. Harvests were taken during the growing seasons 2003 to 2009.","biogeochemistry, ecology, community, community, plant part, biological process, manipulation process, carbon, nitrogen cycle, inorganic matter, nutrient, organic matter, biodiversity, vegetation, vegetation, leaf, production, fertilization, nitrogen, inorganic nutrient, vegetation dynammics, leaf area index, leaf area, primary production"
"knb-lter-arc.10008","List of plant species and species codes for ITEX flux survey","A list of plant species encountered during the ITEX flux survey, with their corrresponding 6 letter codes and functional groups. Research sites were located in the Toolik Lake LTER fertilization experiment in Alaska; at Imnavait Creek, Alaska; at Paddus, Latnjajaure and the Stepps site near Abisko in northern Sweden; at various sites in Adventdalen, Svalbard; in the Zackenberg valley, Northeast Greenland; at BEO near Barrow, Alaska and at the Anaktuvuk River Burn in Alaska. Data was collected during the growing seasons 2003 to 2006.","ecology, ecosphere event, manipulation process, biodiversity, fire, fertilization, species richness"
"knb-lter-arc.10011","Arctic 2006: Relative percent cover was measured for plant species on Arctic LTER experimental plots in moist acidic, dry heath and moist non-acidic tundra, and for Sagavanirktok River plots in tussock and heath tundra.","Relative percent cover was measured for plant species on Arctic LTER experimental plots at Toolik field station in moist acidic and moist non acidic tussock tundra, and dry heath tundra, and on Sagavanirktok River toposequence plots in tussock and heath tundra.","ecology, ecosphere event, environmental process, biodiversity, disturbance, disturbance, abundance, plant cover"
"knb-lter-arc.10012","Relative percent cover was measured for plant species on Arctic LTER experimental plots in moist acidic, dry heath and moist non-acidic tundra, and for Sagavanirktok River plots in tussock and heath tundra, North Slope Alaska 2004.","Relative percent cover was measured for plant species on Arctic LTER experimental plots at Toolik field station in moist acidic and moist non acidic tussock tundra, and dry heath tundra, and on Sagavanirktok River toposequence plots in tussock and heath tundra.","ecology, ecosphere event, environmental process, landform, biodiversity, disturbance, disturbance, hillslope, abundance, plant cover"
"knb-lter-arc.10013","Arctic LTER 2005: Relative percent cover was measured for plant species on Arctic LTER experimental plots in moist acidic, moist non-acidic and dry heath tundra.","Relative percent cover was measured for plant species on Arctic LTER experimental plots at Toolik field station in moist acidic and moist non acidic tussock tundra, and dry heath tundra.","ecology, ecosphere event, environmental process, biodiversity, disturbance, disturbance, abundance, plant cover"
"knb-lter-arc.10017","Hourly weather data from Toolik Field Station, ARC LTER, Alaska for 2007.","Hourly weather data from the Arctic Tundra LTER site at Toolik Lake. The following parameters are measured every minute and averaged or totaled every hour: air temperature and relative humidity at 1 and 5 meters, wind speed at 1 and 5 meters, wind direction at 5 meters, global solar radiation, photosynthetically active radiation, barometric pressure, and unfrozen precipitation.","meteorology, hydrologic process, air, temperature, precipitation, radiation, relative humidity, weather, wind, precipitation, air, air temperature, photosynthetically active radiation, wind speed"
"knb-lter-arc.10018","Soil and canopy temperature data from the Arctic LTER Moist Acidic Tussock Experimental plots for 2007, Toolik Filed Station, North Slope, Alaska.","Soil and canopy temperature data from the LTER Moist Acidic Tussock Experimental plots. In 1989 a treatment plots were established in a moist acidic tundra. Treatments include nitrogen and phosphorus addition, warming with a simple greenhouse, warming with nitrogen and phosphorus addition, shading with shade cloth and shading with nitrogen and phosphorus. In 1990 data logger was installed in block 2 to measure soil temperatures and basic meteorological data. The plots are located on a hillside near Toolik Lake (68 38&#039; N, 149 36&#039;W). Sensors were placed in control, fertilized, greenhouse, greenhouse fertilized, shade house and shade house fertilized sites.","biogeochemistry, meteorology, soil science, device, experiment, community, plant part, manipulation process, landform, layer, nitrogen cycle, phosphorus cycle, temperature, weather, soil temperature, sensor, greenhouse, canopy, wood, fertilization, warming, hillslope, canopy, nitrogen, phosphorus"
"knb-lter-arc.10019","Soil and canopy temperature data from the Arctic LTER Moist Acidic Tussock Experimental plots for 2006, Toolik Filed Station, North Slope, Alaska.","Soil and canopy temperature data from the LTER Moist Acidic Tussock Experimental plots. In 1989 a treatment plots were established in a moist acidic tundra. Treatments include nitrogen and phosphorus addition, warming with a simple greenhouse, warming with nitrogen and phosphorus addition, shading with shade cloth and shading with nitrogen and phosphorus. In 1990 data logger was installed in block 2 to measure soil temperatures and basic meteorological data. The plots are located on a hillside near Toolik Lake (68 38&#039; N, 149 36&#039;W). Sensors were placed in control, fertilized, greenhouse, greenhouse fertilized, shade house and shade house fertilized sites.","biogeochemistry, meteorology, soil science, device, experiment, community, plant part, manipulation process, landform, layer, nitrogen cycle, phosphorus cycle, temperature, weather, soil temperature, sensor, greenhouse, canopy, wood, fertilization, warming, hillslope, canopy, nitrogen, phosphorus"
"knb-lter-arc.10020","Growth data was collected on one deciduous shrub species on Arctic LTER experimental plots in moist acidic tussock and dry heath tundra 2004, Toolik Field Station, Alaska.","Weekly growth of plant species of three growth forms were measured in the ninth year of a long-term experiment at Toolik Field Station. The experimental treatments excluded small and large mammalian herbivores and increased soil nutrients in two arctic Alaskan tundra communities: moist acidic tussock and dry heath. This data set reports the deciduous dwarf shrub species. Please see 2004lggrgram for the tussock-forming and rhizomatous graminoid species growth data.","biogeochemistry, ecology, ecosphere event, community, animal, plant, biological process, community process, environmental process, manipulation process, nutrient, biodiversity, disturbance, herbivore, vertebrate, vascular plant, growth, production, herbivory, disturbance, fertilization, community dynamics, mammal, shrub, primary production"
"knb-lter-arc.10021","Growth data was collected on four graminoid species on Arctic LTER experimental plots in moist acidic tussock and dry heath tundra 2004, Toolik Field Station, Alaska.","Weekly growth of plant species of three growth forms were measured in the ninth year of a long-term experiment at Toolik Field Station. The experimental treatments excluded small and large mammalian herbivores and increased soil nutrients in two arctic Alaskan tundra communities: moist acidic tussock and dry heath. This data set reports the four graminoid (both tussock and rhizomatous forms) species. Please see 2004lggrbnan for Betula nana (dwarf shrub) growth data.","biogeochemistry, ecology, ecosphere event, community, animal, plant, biological process, community process, environmental process, manipulation process, nutrient, biodiversity, disturbance, herbivore, vertebrate, vascular plant, growth, herbivory, disturbance, fertilization, community dynamics, mammal, shrub"
"knb-lter-arc.10022","Hourly weather data from Toolik Field Station, ARC LTER, Alaska for 2008.","Hourly weather data from the Arctic Tundra LTER site at Toolik Lake. The following parameters are measured every minute and averaged or totaled every hour: air temperature and relative humidity at 1 and 5 meters, wind speed at 1 and 5 meters, wind direction at 5 meters, global solar radiation, photosynthetically active radiation, barometric pressure, and unfrozen precipitation.","meteorology, hydrologic process, air, temperature, precipitation, radiation, relative humidity, weather, wind, precipitation, air, air temperature, photosynthetically active radiation, wind speed"
"knb-lter-arc.10023","Daily weather summaries from Toolik Field Station Weather Station, Toolik Lake ARC LTER, Alaska for 2008.","Daily weather summaries from Toolik Field Station Meteorological Station, Toolik Lake, Alaska. Included are daily averages and/or maximums and minimums of air, soil and lake temperature, wind speed, vapor pressure, and sum of global radiation and precipitation recorded near Toolik Lake.","meteorology, aquatic, hydrologic process, air, precipitation, radiation, temperature, weather, wind, freshwater, lake, precipitation, air, wind speed"
"knb-lter-arc.10024","Soil temperatures, lake temperature, lake depth, and evaporation pan depth and pan water temperature data from Toolik Field Station, Toolik Lake, Alaska for 2008.","Weather data file for Arctic Tundra LTER site at Toolik Lake. Only the sensors that are measured every 10 minutes and averaged every three hours are include, i.e. soil temperatures, lake temperature, lake depth, and evaporation pan depth and pan water temperature.","ecology, hydrology, meteorology, soil science, aquatic, device, aquatic ecology, evaporation, temperature, weather, soil temperature, freshwater, lake, sensor"
"knb-lter-arc.10025","Above ground plant and below ground stem biomass in the Arctic LTER dry heath tundra experimental plots, 2006, Toolik Lake, Alaska","Above ground plant and below ground stem biomass, percent nitrogen, and percent carbon were measured in the Arctic LTER dry heath tundra experimental plots. Treatments included control, and nitrogen and phosphorus amended plots for 10 years, and exclosure plots with and without added nitrogen and phosphorus.","biogeochemistry, ecosphere event, experiment, plant part, biological process, environmental process, carbon, nitrogen cycle, inorganic matter, nutrient, organic matter, phosphorus cycle, disturbance, field manipulation, stem, production, disturbance, nitrogen, inorganic nutrient, phosphorus, exclosure, primary production"
"knb-lter-arc.10026","Above ground plant and below ground stem biomass in the Arctic LTER moist acidic tussock tundra experimental plots, 2006, Toolik Lake, Alaska","Above ground plant and below ground stem biomass, percent nitrogen, and percent carbon were measured in the Arctic LTER moist acidic tundra experimental plots. Treatments included control, and nitrogen and phosphorus amended plots for 10 years, and exclosure plots with and without added nitrogen and phosphorus.","biogeochemistry, ecosphere event, experiment, plant part, biological process, environmental process, carbon, nitrogen cycle, inorganic matter, nutrient, organic matter, phosphorus cycle, disturbance, field manipulation, stem, production, disturbance, nitrogen, inorganic nutrient, phosphorus, exclosure, primary production"
"knb-lter-arc.10029","Arctic LTER 2007: Relative percent cover was measured for plant species on Arctic LTER experimental plots in moist acidic tussock and dry heath tundra.","Relative percent cover was measured for plant species on Arctic LTER experimental plots at Toolik field station in moist acidic tussock and dry heath tundra.","ecology, ecosphere event, environmental process, biodiversity, disturbance, disturbance, abundance, plant cover"
"knb-lter-arc.10052","Bulk concentration and isotopic information of plant C and N in green leaves and tissues collected from Imnavait watershed during 2003-2005","Changes in total C and N, d13C and d15N, C:N ratio in green leaves and parts of mosses (for sphagnum, both red and green tips were included) over time since 15NH4 addition in Imnavait watershed.","biogeochemistry, plant, plant part, biological process, landform, carbon, isotope, nitrogen cycle, inorganic matter, nutrient, organic matter, moss, leaf, production, watershed, ammonium, nitrogen, inorganic nutrient, primary production"
"knb-lter-arc.10063","Bacterial Production Data for lakes and lake inlets/outlets samples collected summer 2008, Arctic LTER, Toolik Research Station, Alaska.","Yearly file containing information on bacterial productivity. Samples were collected at various sites near Toolik Research Station (68 38'N, 149 36'W). Sample site descriptors include an assigned number (sortchem), site, date, time and depth.","biogeochemistry, ecology, aquatic, microbe, biological process, carbon, biodiversity, freshwater, lake, stream, bacteria, production, community dynamics, bactereial production"
"knb-lter-arc.10064","Bacterial Production Data for lakes and lake inlets/outlets samples collected summer 2007, Arctic LTER, Toolik Research Station, Alaska.","Yearly file containing information on bacterial productivity. Samples were collected at various sites near Toolik Research Station (68 38'N, 149 36'W). Sample site descriptors include an assigned number (sortchem), site, date, time and depth.","biogeochemistry, ecology, aquatic, microbe, biological process, carbon, biodiversity, freshwater, lake, stream, bacteria, production, community dynamics, bactereial production"
"knb-lter-arc.10065","Bacterial Production Data for lakes and lake inlets/outlets samples collected summer 2009, Arctic LTER, Toolik Research Station, Alaska.","Yearly file containing information on bacterial productivity. Samples were collected at various sites near Toolik Research Station (68 38'N, 149 36'W). Sample site descriptors include an assigned number (sortchem), site, date, time and depth.","biogeochemistry, ecology, aquatic, microbe, biological process, carbon, biodiversity, freshwater, lake, stream, bacteria, production, community dynamics, bactereial production"
"knb-lter-arc.10068","Toolik Inlet Discharge Data collected in summer 2008, Arctic LTER, Toolik Research Station, Alaska.","Stream discharge, stage height, temperature, and conductivity of Toolik Inlet during the 2008 study season.","biogeochemistry, ecology, hydrology, meteorology, aquatic, hydrologic process, conductivity, aquatic ecology, discharge, stage height, water level, temperature, freshwater, stream, discharge"
"knb-lter-arc.10069","Toolik Inlet Discharge Data collected in summer 2007, Arctic LTER, Toolik Research Station, Alaska.","Stream discharge, stage height, temperature, and conductivity of Toolik Inlet during the 2007 study season.","biogeochemistry, ecology, hydrology, meteorology, aquatic, hydrologic process, conductivity, aquatic ecology, discharge, stage height, water level, temperature, freshwater, stream, discharge"
"knb-lter-arc.10070","Toolik Inlet Discharge Data collected in summer 2009, Arctic LTER, Toolik Research Station, Alaska.","Stream discharge, stage height, temperature, and conductivity of Toolik Inlet during the 2009 study season.","biogeochemistry, ecology, hydrology, meteorology, aquatic, hydrologic process, conductivity, aquatic ecology, discharge, stage height, water level, temperature, freshwater, stream, discharge"
"knb-lter-arc.10083","Anaktuvuk River Burn Eddy Flux Measurements, 2008 Moderate Burn Site, North Slope Alaska","We deployed three eddy covariance towers along a burn severity gradient (i.e. severely-, moderately-, and un-burned tundra) to monitor post fire Net Ecosystem Exchange of CO2 (NEE) within the large 2007 Anaktuvuk River fire scar during the summer of 2008. This data represents the first post fire growing season&#039;s energy and mass exchange at the moderate burn site.","biogeochemistry, ecosphere event, device, environmental process, measurement process, air, landform, carbon, disturbance, fire, sensor, disturbance, eddy covariance, air, hillslope, eddy covariance"
"knb-lter-arc.10084","Anaktuvuk River Burn Eddy Flux Measurements, 2008 Unburned Site, North Slope Alaska","We deployed three eddy covariance towers along a burn severity gradient (i.e. severely-, moderately-, and un-burned tundra) to monitor post fire Net Ecosystem Exchange of CO2 (NEE) within the large 2007 Anaktuvuk River fire scar during the summer of 2008. This data represents the first post fire growing season's energy and mass exchange at the unburned site.","biogeochemistry, ecosphere event, device, environmental process, measurement process, air, landform, carbon, disturbance, fire, sensor, disturbance, eddy covariance, air, hillslope, eddy covariance"
"knb-lter-arc.10085","Anaktuvuk River Burn Eddy Flux Measurements, 2008 Severe Burn Site, North Slope Alaska","We deployed three eddy covariance towers along a burn severity gradient (i.e. severely-, moderately-, and un-burned tundra) to monitor post fire Net Ecosystem Exchange of CO2 (NEE) within the large 2007 Anaktuvuk River fire scar during the summer of 2008. This data represents the first post fire growing season's energy and mass exchange at the severe burn site.","biogeochemistry, ecosphere event, device, environmental process, measurement process, air, landform, carbon, disturbance, fire, sensor, disturbance, eddy covariance, air, hillslope, eddy covariance"
"knb-lter-arc.1009","Meteorological data collected on Toolik Lake during the ice free season since 1989 to 2009, Arctic LTER, Toolik Research Station, Alaska.","Yearly file describing the metological conditions on Toolik Lake (named the Toolik Lake Climate station), adjacent to the Toolik Field Research Station (68 38'N, 149 36'W). This is a floating climate station and should not be confused with the Toolik Field Station Climate site (TFS Climate Station or Met Station) which is a terrestrial station (located on land). Note that this land station has been called the ""Toolik Main Climate Station"", and the station on the lake is located where the main lake sampling site is located so it has also been called the Toolik Lake Main Climate Station. Measurements include air temperature, relative humidity, wind direction, wind speed, and radiation.","meteorology, aquatic, hydrologic process, air, temperature, radiation, relative humidity, wind, freshwater, lake, ice, air, air temperature, wind speed"
"knb-lter-arc.10090","Water chemistry data for various lakes near Toolik Research Station, Arctic LTER. Summer 2000 to 2009.","Decadal file describing the water chemistry in various lakes near Toolik Research Station (68 38'N, 149 36'W) during summers from 2000 to 2009. Chemical analyses were conducted on samples from various depths in the sample lakes either once, or multiple times during the spring, summer and fall months (May to September). Chemical analyses for the samples include alkalinity, dissolved organic and inorganic carbon (DIC/DOC), inorganic and total dissolved nutrients (NH4, PO4, NO3, TDN, TDP), particulate carbon, nitrogen and phsphorous (PC, PN, PP), cations (Ca, Mg, K, Na and Si) and anions (SO4, Cl). See methods for the yearly datsets which were combined into this data set.","biogeochemistry, aquatic, anion, carbon, cation, nitrogen cycle, inorganic matter, nutrient, phosphorus cycle, sulfur cycle, water biogeochemistry, freshwater, lake, ammonium, nitrate, nitrogen, inorganic nutrient, phosphorus, sulfate"
"knb-lter-arc.10093","Average Epilimnetic Conductivity from 1992 to present in Tooli Lake, Arctic LTER, Alaska.","Average conductivity of the epilimnion (0-3m of water depth) found in Toolik Lake during the month of July.","biogeochemistry, ecology, aquatic, water, conductivity, inorganic matter, nutrient, aquatic ecology, freshwater, lake, fresh water, inorganic nutrient, limnology"
"knb-lter-arc.10104","Soil ergosterol transect Dalton Highway Alaska 2007","The data set describes soil ergosterol concentration, which is unique to fungal membranes., from an Alaska transect . The soil samples from Alaska were collected in a trip from north to south along the Dalton Highway. north of the Yukon River.","field method, transect"
"knb-lter-arc.10105","Soil ergoserol concentration from Abisko Sweden 2007.","The data set describes soil ergosterol concentration, which is unique to fungal membranes., from samples from Abisko, Sweden. The samples from Abisko, Sweden, were collected by E.A. Hobbie at a birch forest site and a tundra site. The Abisko sites are described in www.abacus-ipy.org/fieldsites/abisko.html.","terrestrial, forest"
"knb-lter-arc.10106","Plant litter, soil, plants and fungal fruiting bodies 15N, 13C, percent C and N along Dalton Highway, Alaska 2004, 1990, 2007.","The data set includes 15N and 13C for plant litter, soil, plants and fungal fruiting bodies (mycorrhizae), percent C (soil organic matter and percent N from samples collected in three separate trips (1990, 2004, 2007) along the transect of the Dalton Highway (AK) extending from the Yukon River on the south to Prudhoe Bay on the north.","biogeochemistry, field method, fungus, plant part, nitrogen cycle, organic matter, transect, mycorrhizae, leaf, nitrogen, leaf litter"
"knb-lter-arc.10107","Welker Shrub Microclimate Data from an unmanipulated shrub patch near Toolik Field Station, August 6, 2006 to September 12, 2010","Hourly air temperature, humidity, wind speed, soil temperature and soil water data from an unmanipulated shrub patch measured from August 6, 2006 to September 12, 2010.","meteorology, soil science, plant, air, temperature, microclimate, wind, soil temperature, vascular plant, air, air temperature, wind speed, shrub"
"knb-lter-arc.10108","Welker Dry Heath Microclimate Data","Hourly air temperature, humidity, wind speed, soil temperature and soil water data from the control area of the ITEX dry heath study site","meteorology, soil science, experiment, air, temperature, microclimate, wind, soil temperature, field manipulation, air, air temperature, wind speed, snowfence"
"knb-lter-arc.10109","Welker ITEX Tussock Microclimate Data","Hourly air temperature, humidity, wind speed, soil temperature and soil water data from the control area of the ITEX tussock tundra snowfence study site","meteorology, soil science, experiment, air, temperature, microclimate, wind, soil moisture, soil temperature, field manipulation, air, air temperature, wind speed, snowfence"
"knb-lter-arc.10110","Welker IPY snow shrub 2007 flux data, Toolik, Alaska.","This is a study of how different snow regimes effect CO2 exchange in tussock tundra and whether there are shifts in ecosystem C cycling when facets of &quot;drift&quot; effects are isolated. The study is part of the IPY program and is aimed at measuring the state of Arctic tundra.","biogeochemistry, meteorology, ecosphere event, plant, biological process, environmental process, physiological process, water, carbon, snow, disturbance, vascular plant, production, disturbance, respiration, snow, shrub"
